sour,make me something sour,make me something Sauer,make me something Sour,make me something sower,make me some things Sauer,make me some things Sour
sour,make me something sour,make me something Sauer,make me something Sour,make me something sower,make me some things Sauer,make me some things Sour
sour,make me something sour,make me something Sauer,make me something Sour,make me something sower,make me some things Sauer,make me some things Sour
sour,make me a salad drink,make me a sandwich drink,make me a sandwich drank,make me a salad rink,make me a sandwich drinking,make me a salad drinking
sour,make me a salad drink,make me a salad rink,make me a sandwich drink,make me a salad Drink,make me a salad drinking,make me a salad Rink
sour,make me a sandwich drink,make me a sandwich drank,make me a sammich drink,make me a sammich drank,make me a salary drink,make me a sandwich Drink
sour,make me a word,make me at work,make me a river,make me a salary,make me a Salvador,
sour,make me a salad,make me a sandwich,make me a sammich,make me a sad,make me a Sally,
sour,make me a salad or drink,make me a drink,make me a salad drink,make me a salad drank,make me a drank,make me a south drink
sour,make me a cell are drink,make me a cell are drunk,make me a seller drink,make me a salad drink,make me a cell are drinks,make me a seller drank
sour,make me a sandwich,make me a salary,make me a salad,make me a sammich,make me a sound,
sour,make me something sour,make me something,make me something South,make me something south,make me something cell,make me some things south
sour,make me a salad,make me a sandwich,make me sound,make me up,make me a salary,make me on a salary
sour,make me a salad or drink,make me a salad a drink,make me a salad drink,make me a salad drank,make me a south drink,make me a salad train
sour,I want something sour,I want something Sauer,I want something Sour,I want something sower,I want some things Sauer,I want some things Sour
sour,I want something sour,I want something Sauer,I want something Sour,I want something sower,I want some things Sauer,I want some things Sour
sour,I want to sour drink,I want a sour drink,I want to sour drinks,I want a sour drinks,,
sour,I want a sour drink,I want a sour drinks,,,,
sour,I'd like a sour drink,I'd like a sour cream,I'd like a sour drinks,I'd like a sour dream,I'd like a sour cherry,
sour,I'd like something sour,I like something sour,I'd like some things our,,,
sweet,make me something sweet,,,,,
sweet,make me something sweet,,,,,
sweet,make me a sweet drink,make me a sweet dreams,make me a sweet dream,make me a sweet drinks,make me a suite drink,make me a sweep drink
sweet,make me a sweet drink,make me a sweet dreams,make me a sweet dream,make me a sweet drinks,make me a sweet tree,
sweet,make me a sweet dreams,make me a sweet dream,make me a sweet drink,make me a sweet tree,make me a sweet drinks,
sweet,something sweet,Atlanta something sweet,Mike something sweet,,,
sweet,unlike something sweeter,unlike something sweet,unlike something sweet ur,unlike something sweet earth,unlike something sweet Deer,
sweet,sweeter drink,sweet drink,sweeter Drink,sweeter drank,sweeter Drake,sweeter drinks
sweet,get me something sweet,give me something sweet,,,,
bitter,make me something better,make me something bitter,make me some things bitter,make me something to bitter,make me something by bitter,
bitter,maybe something better,make me something better,,,,
bitter,make me a better drink,make me a better to drink,make me a better Drink,make me a better drinks,make me a better drinking,
bitter,make me a better drink,make me a better Drink,make me a better to drink,make me a better drank,make me a builder Drink,make me a builder drank
bitter,make me up dinner drink,make me up dinner drinks,make me up dinner Drink,make me up dinner drank,make me a better Drink,make me a better drank
bitter,make me a better drink,make me up bitter drink,make me a better to drink,make me a picture drink,make me a bitter drink,make me a better Drink
bitter,make me a bitter drink,make me a better drink,make me a better to drink,make me a bitter Drink,make me a bitter drank,make me up a bitter drink
bitter,I want something better,I want something bitter,I want something de ser,I want something deter,I want something that sir,I want some things bitter
bitter,make me something dinner,make me something better,make me something Dinner,make me something Banner,make me something banner,make me some things dinner
carbonated,make me something carbonated,make me some things carbonated,make me something cars,make me something,make me something car,make me something card
carbonated,make me something fizzy,make me some things fizzy,make me something fishy,make me something 50,make me something fizzies,make me something sexy
carbonated,make me something bubbly,make me something probably,make me something public,make me something Publix,make me something published,make me some things probably
carbonated,make me something with carbonation,make me something with combination,make me some things carbonation,make me something was carbonation,make me something with combinations,make me something with carnation
carbonated,make me a carbonated drink,make me a carbonated drinks,,,,
carbonated,make me a fizzy drink,make me a fizzy drinks,,,,
carbonated,make me a bubbly drink,make me a bubbly drank,make me a bubbly Drink,make me a bubbly drinks,make me a public drink,make me a bubbly drinking
carbonated,I want a fizzy drink,I want to fizzy drink,I want a fizzy drinks,I want to fizzy drinks,I want to secede rink,I want a fizzy drink it
carbonated,I want something fizzy,I want some things fizzy,I want something to fizzy,I want something for fizzy,,
carbonated,Lincoln fizzy drink,I like a fizzy drink,Linkin fizzy drink,I'd like a fizzy drink,Lincoln City drink,Lincoln fizzy drinks
carbonated,Mike something City,Mike something fizzy,Mike something sexy,Mike something city,Mike something sissy,somethings City
carbonated,something carbonated,Atlanta something carbonated,somethings carbonated,something's carbonated,sumthing carbonated,something carbon dated
carbonated,I want something carbonated,I want something carbonate,I want something carbones,I want something Carbonite,I want something Carbondale,I want some things carbonated
carbonated,get me something fizzy,get me something sexy,get me something City,get me something fishy,get me something fancy,get me some things fizzy
creamy,make me something creamy,make me something cream,make me something,make me something for me,make me something Creek,make me some things creamy
creamy,make me something cream,make me something Kreme,make me something Cream,make me something creme,make me something crazy,make me some things cream
creamy,what makes something creamy,what makes something cream,what makes something creaming,what makes something creepy,what makes something Kreme,sumthing creamy
creamy,something creamy,creamy,something creaming,something for me,Something free mean,creaming
creamy,I want something creamy,I want something for me,I want something from me,creamy,I want something creaming,creaming
creamy,creamy drink,creamy Drake,creamy drank,creamy train,creamy drinks,creemee drink
creamy,make me something fun supreme,make me something fun to cream,make me something fun Supreme,make me something funny cream,make me something fun to Kreme,make me something fun Kreme
creamy,make me something creamy,make me something preemie,make me something preemies,make me something for me,make me something creaming,make me some things creamy
creamy,I want a creamy drink,I want a creamy Drake,what's a creamy drink,I want to clean the drain,what is a creamy drink,I want a creamy drank
creamy,I want a creampie,I want to cream,I want to cry,I want to clean,I want a cream,what's a cream
creamy,make me a creamy drink,make me a cream drink,make me a creamy drinks,make me a creamy Drink,make me a creamy drank,make me scream drink
creamy,make me a drink and screaming,make me a drink and creamy,make me a drink is creamy,make me a drink in scream,make me a drink that scream,make me to drink is creamy
creamy,make me a drink that scream,make me a drink that screams,make me a drink that cream,make me a drink scream,make me a drink the scream,
alcoholic,make me something strong,make me something stronger,make me something Strong,make me something wrong,make me some things Strong,
alcoholic,make me something strong,make me something stronger,make me something Strong,make me some things Strong,Strong,
alcoholic,make me something,make me something with,make me something with water,make me something with lock,make me something with one,make me something ive
alcoholic,make me something with lots of alcohol,make me something with alcohol,make me something with lots in alcohol,make me something with lots of the alcohol,make me something with lots of alchohol,make me something with lots in alchohol
alcoholic,make me something with lots of liquor,make me something with lots of liqour,make me something with lots of likker,make me something with lots of liqueur,make me something with lots of licker,make me something ive liqueur
alcoholic,make me a strong drink,make me a strong drinks,make me a strong rink,make me a strong Drink,make me a stronger Inc,make me a stronger rink
alcoholic,give me something strong,give me something stronger,give me something Strong,give me some things Strong,give me something to Strong,give me something for Strong
alcoholic,on something strong,on something Strong,somethings wrong,something's wrong,on something wrong,on something stronger
alcoholic,make me strong drink,make me strong drank,make me strong rink,make me strong drinks,make me strong Drink,make me stronger rink
alcoholic,drink that strong,strong,drink strong,drink that Strong,drinks at Strong,drinks and strong
alcoholic,I'd like to drink,I'd like a drink,I'd like a drink that,I'd like a dream,I'd like to drink c**,drink that
none,make me a reminder,make me up,make me c**,make me a room,make me over,
none,I want to run in Co,I want to run in cups,I want to running Co,I want to run and Co,I want to run in Cup,I want to run in cold
none,give me a rum and coke,give me a Roman code,give me a run in Co,give me a run and Co,give me a Roman Co,give me a running Co
none,make me a gin and tonic,make me a channel,make me a chance,make me a genotype,make me a joke,
none,gin and tonic,wanted gin and tonic,I want to gin and tonic,I wanted gin and tonic,I want it gin and tonic,
none,give me a gin and tonic,give me a a gin and tonic,,,,
none,I like a gin and tonic,I'd like a gin and tonic,,,,
none,me a gin and tonic,imagine in time,Emagine Canton,imagine a time,imagine and time,Mia gin and time
none,image in tonic,Imogen tonic,images tonic,Imogen Thomas,imagens tonic,image in Titanic
none,on a gin and tonic,on a genotype,on a gin and tonics,on a tenant on,what a genotype,what a tenant on
none,10 times,10 in time,Canton,can a time,10 ton,
none,get me a rum and coke,get me a run in Coke,get me a rum and koke,get me around and Coke,get me a Roman Catholic,
none,make a rum and coke for me,make a rum and coke for mi,make a rum and coke army,make a rum and coke for me.,make a rum and coke or mi,make a rum and coke 4 mi
none,I'll try and run in Coke,I'll try and run in cups,I'll try and run in Co,I'll try and coke,I'll try coke,I'll try running Co
none,rum and coke,rum and koke,rum and Coca,Roman code,Roman Coke,remind Coke
none,make me a White Russian,,,,,
none,I'm going to try a White Russian,I'm going to try and white russian,I'm going to try and White Russians,I'm going to try White Russians,I'm going to try and white Russia,how to train a White Russian
none,give me MP skull,give me a piece called,give me MP school,give me a piece of coal,give me mp3 skull,give me in peace called
none,hello of Peace Corps,hello Peace Corps,hello MP skull,hello of Peace Corp,Peace Corps,hello Peace Corp
none,I try and Peace Corps,I try and please call,I try and peace call,I try and peace college,I try and Peace cost,I'm trying Peace Corps
none,get me insured companies,get me insured,get me insured please,please,get me insured temple,get me insured lease
none,I'm going to try and Shirley Temple,I'm going to try a Shirley Temple,I'm going to try and Shirley temples,I'm going to try in a Shirley Temple,I'm going to try and shirly temple,I'm going to try to a Shirley Temple
none,give me a margarita,give me a reason,give me a marina,give me a Mirena,give me a Rita,
none,how bout a mercury,how about a margarita,how bout a margarita,how about a Maria,Maria,how about a murder
none,margarita please,margarita,margarita fleas,mercury to please,margaritas,Macarena please
none,make a margarita,make margaritas,McMurray,MacMurray,make my area,
none,give me love you,give me love you neyo,give me love you neo,Give Me Love You,give me love ya,
none,can I have a mojito,can I have a mosquito,can I have a movie to,can I have a movie dubbed,can I have a movie times,
none,make me love you,make me laugh,McNeil,make me that heat,make me love you too,
none,I like to order a,I like to order a mojito,I'd like to order a,I'd like to order a mojito,I like to order a liter,I like to order a meter
none,make a mint julep,Mike Mitchell,make Mitchell,anchorman 2,making Mitchell,McMinnville
none,the mood for Mitchell,Nutramigen,furniture,the mood for Mitchell's,Furniture,mood for Mitchell
none,China mint julep,China,try and Juliet,Triaminic,try and Julia,Chinaman
none,images,Angela,Temecula,Angelo,Mitchell,
none,vodka and orange juice,vodka and orange shoes,,,,
none,510 orange juice,5 ton orange juice,5 gun orange juice,gun orange juice,510 Orange Juice,5 ton Orange Juice
none,make a whiskey sour,whiskey sour,whisky sour,make a whisky sour,making whiskey sours,make a whiskey sours
none,get me an electric company,get me an electric eel,get me an electric oven,get me an electric companies,get me an electric fence,get me in electric oven
none,wake me up at Electric lemonade,wake me up an Electric lemonade,miss me up an Electric lemonade,wake me up an electric laminate,wake me up an electric,wake me up at Electric laminate
none,Electric lemonade please,Electric lemonade lease,Electric lemonade plea,Electric lemonade Pleas,Electric lemonade cookies,Electric clinic plea
none,make me an old fashioned,make me old fashioned,make me an old fashion,make me a note,McDonalds,
none,how about no,how bout no,about,hello,how about no Thai,
none,I'll try an old fashioned,I'll try an old fashion,I'll try a*** casting,I'll try a***,all triangles,
none,get me an old fashioned,get me an old fashion,,,,
none,make me something without alcohol,,,,,
none,something,somethings,something new,Something,something else,
none,something to draw a person,something to draw,address,something to drink,something,something address
none,inversion drink,inversion Drake,inversion drank,inversions drink,inversion Drink,inversion drunk
none,no alcohol,Noel,Noelle,new Apple,m***,
none,make me a tequila sunrise,tequila sunrise,Tequila Sunrise,make me a Tequila Sunrise,make me tequila sunrise,naked tequila sunrise
none,make me a reminder,make me a reminder search,make me a reminder for,make me a minor,make me in mind,
none,make me a mind eraser,,,,,
none,give me my dresser,get me minors,give me a minors,give me minors,give me a minor,give me a reminder
none,miss me up a Long Island iced tea,miss me up a long island ice tea,miss me up a Long Island Iced Tea,miss me up a Long Island iced teas,miss me up a long island ice T,
none,give me a Roy Rogers,give me a White Rodgers,give me a river otters,give me a Roy Rogers show,give me a Roy Rogers die,
none,make me a mind eraser,make me in mind erasers,make me a reminder racer,,,
none,make me a reminder,make me a reminder eyes,make me a reminder in,make me a reminder at,make me a reminder ice,
none,I'd like a mind eraser,Monterey,Monterey CA,I'd like a line array,I'd like a line razor,I'd like a minor razor
none,I'd like a mint julep,I'd like a ninja,Lincoln Ventura,Lincoln Angeles,I'd like a venture,Linkin Ventura
none,I'd like a piece Cola,I'd like a piece cola,I'd like a piece cooler,I'd like a piece Chola,I'd like a piece colour,I'd like a piece of cola
none,I would like a AP Scholar,I would like a Pisco,I would like a AP scores,I would like a AP score,I would like a piece called,I would like a peace called
none,give me electric lemonade,give me an electric lemonade,give me electric Lemonade,give me an electric Lemonade,give me electric limited,give me electric Lebanon
none,give me an electric lemonade,give me an electric,give me an electric eel,give me an electric Lemonade,give me an electric line,give me an electrical Lemonade
none,MS cotton,MP skull,scotch and soda,MS Contin,Scott,Tempe scotch and soda
none,make me a scotch and soda,is cotton center,make me a scotch and Soda,is constant center,is cotton Center,sconsin Center
none,I want a scotch and soda,I want a scotch and Soda,I want a Scott answer,I want a scotch and sirloin,I want a dancer,I want a scotch answer
none,I want to Skype,I wanna scotch and soda,I want a scotch and soda,I want to Scott,I wanna Scott,I want to scotch and soda
none,give me a Birmingham water,give me a river mean in water,give me a Birmingham Water,give me a river otter,water,
none,I want to come in,I want to Brandon,I want to burn in,I want to burn,I want to end,
none,water,I like a virgin and water,I like a permanent water,Water,I like a permanent Water,I like water
none,make me a Birmingham,make me a bird in water,make me a Birmingham water,make me a bird,make me a permanent marker,
none,Havana Cuba Libre,Havana Cuba Libre a,Cuba Libre,Havana Cuba Libra,Havana Cuba libres,Havana Cuba lyrics
none,make me a Cuba Libre,make me a Cuba Libre a,make me a Cuban lyrics,make me cubra libre,make me feel lyrics,make me a cube lyrics
none,make me a Cuba Libre,make me a Cuba Libre a,making a Cuba Libre,Cuba Libre,make a Cuba Libre,make me Cuba Libre
none,make me a Cuba Libre,Cuba Libre,make me a Cuba Libre a,make me Cuba Libre,mechanic you lee Brice,Cuba Libre a
none,I'd like a Cuba Libre,Cuba Libre,I'd like a Cuba Libre a,Cuba Libre a,I like it Cuba Libre,I'd like a Cuban lyrics
none,make me a pisco sour,pisco sour,power,make me a pizza power,make me a piece power,
none,give me a pisco sour,give me a Pisco Sour,give me a pisco sours,,,
none,make me a pisco sour,make me a Pisco Sour,make me a piece of summer,make me a pisco sours,McNeil a pisco sour,MacNeal a pisco sour
none,give me a pisco sour,give me a few hours,give me a few hour,give me a pisco sours,can a pisco sour,a pisco sour
none,make me a dark and stormy,dark and stormy,make a dark and stormy,make me a dark and stormy night,make me dark and stormy,make me a darkened storm
none,give me a dark and stormy,dark and stormy,give me a dark and stormy night,a dark and stormy,can a dark and stormy,dark and stormy night
none,make me a dark and stormy,make me a darkened story,make me an Arkansas,making a dark and stormy,make me a darkened Story,darken story
none,like a gin,kitchen,kitchen f***,like a gin buck,like a jinn,jinn
none,make me itch in bulk,make me itch in buck,make me a gym buck,make me itch in box,make me a Jambox,make me a chicken pox
none,make me a gin buck,midget f***,Imogen Bach,midget Bach,Imogen buck,midget buck
none,I want to gin buck,Genbook,I want to JNB up,I want to Jen book,I want to Jen bucks,I want to gin book
none,McMechen Bach,make me a channel lock,McMechen box,McMechen Bock,McMechen Bok,make me a channel Bach
none,give me a gin Rickey,give me a gin wiki,give me a Jinchuuriki,give me a chance Ricky,,
none,make me a gin Rickey,McMansion Ricky,McMansion wiki,McMechen Ricky,McMansion Rocky,McMechen wiki
none,I want to gin Rickey,I want to Jen Ricky,I want to Jen rookie,I want to Jen Rocky,I want to gin review,I want to Jen review
none,like a Tom Collins,"Canton,",Lincoln Town Car,Canton college,Lincoln Tunnel,
none,make me a Tom Collins,Lake Minnetonka,,,,
none,give me a Moscow Mule,Moscow Mule,give me a Moscow,Moscow,give me a Moscow mules,give me a mosque
none,p******,porn hub,I wanna,on you,on,on on
none,I want to Moscow Mule,I want to,I want to you,I want to come you,I want to see you,
none,make me a tonic,wake me up at onyx,make me a pic,wake me up at a time,make me a good time,
none,McNeil Arkansas,McNeil,MacNeal,wake me up,make me,wake me
none,I want a Black Russian,I want a black Russians,I want a black Russia,I want is a Black Russian,,
none,make me a Black Russian,take me to a Black Russian,make me black Russians,take me in,wake me in,
none,I'd like a Black Russian,I'd like a black Russians,I'd like a black person,I'd like a black Russia,,
none,give me a Black Russian,give me a black Russians,,,,
none,Macy engine,Macy engines,Macy engine block,Macy Engine,Macy's engine,Macy inches
none,make me a gym,make me a joke,make me a gin buck,make me a gin,make me itch,make me a gym buck
none,make me a gin buck,make me a gin,make me a ginger,make me a jinn,make me a GYN,
none,I like engine block,I like engine buck,I like in gin buck,I like engine Buck,I like engine knock,I like engines buck
none,get me a gin buck,get me a juicebox,get me engine block,get me engine knock,get me a gin Bach,get me a jinn Bach
sweet,Black Russian women Sweden,Black Russian Sweden,Black Russian sweet enough,Black Russian women sweetener,Black Russian women sweet enough,Black Russian
sweet,apocryphal is too sweet,APAC Russians to sweet,APAC Russian is too sweet,Aflac Russians to sweet,map pack Russians to sweet,Aflac Russian is too sweet
sweet,my Black Russian women sweetheart,my Black Russian women sweetener,Black Russian women sweetheart,my Black Russian was in Sweden,my Black Russian wasn't sweetener,my Black Russian woman sweetener
sweet,my Black Russian was too sweet,my black Russians to sweet,my black Russians too sweet,my black Russians to suite,my black Russians 2 suite,my black Russians to Sweet
alcoholic,Black Russian women strong enough,my Black Russian women strong enough,,,,
alcoholic,Dr Christian is too strong,Dr questions too strong,Dr Christians too strong,Dr Christians to strong,Russian is too strong,Dr Christian's too strong
creamy,Aflac Russian wasn't man enough,Aflac Russian wasn't Indiana,APAC Russian wasn't man enough,Aflac Russian was in Indiana,APAC Russian wasn't Indiana,APAC Russian was in Indiana
creamy,black Russians to creamy,black Russians to cream,Black Russian into cream,black Russians to Kreme,Black Russian is 23 me,Black Russian into Kreme
sweet,White Russian wasn't sweetener,White Russian with me tonight,White Russian sweetener,White Russian sweet enough,White Russian with sweet in a,White Russian with Selena
sweet,that went mission is too sweet,that way Russians to sweet,that one directions to sweet,that way to Russians to sweet,Russians to sweet,that way Russians to suite
alcoholic,fat white women with pretty week,fat white women with pretty Week,fat white women with pretty weak,fat white women with pretty eyes week,that might Marshalls pretties week,that might Marshalls prettier week
alcoholic,Pat White Russians be weaker,Pat White Russians the week,Pat White Russians the weaker,Pat White Russians The Weeknd,Pat White Russians the weekend,Pat White Russian be weaker
creamy,White Russian wasn t me enough,White Russian wasn t me a nap,White Russian wasn t me enuff,White Russian wasn t me not,White Russian wasn t me or not,White Russians wasn t me enough
creamy,White Russian very creamy,White Russian hairy creamy,White Russian Mary cream,White Russian hairy cream,White Russian married Remi,White Russian very cream
sweet,at home fashions was in Sweden,at home fashions in Sweden,at home fashions wasn't sweetener,Pantone fashion was in Sweden,Pantone fashion wasn't sweetener,at home fashion was in Sweden
sweet,at home fashions very sweet,at home fashion very sweet,at home fashions very suite,at home fashions very Suite,at home fashions very sweet tea,at home fashion is very sweet
alcoholic,Atlanta fashion boots 2 week,that on fashion police 2 week,Atlanta fashion with two week,that on fashion police two week,Atlanta fashion boots two week,Atlanta fashion boots 2 weeks
alcoholic,that old fashioned is too strong,that old fashions is too strong,adult fashions is too strong,that old fasioned is too strong,that on fashions is too strong,that old fashined is too strong
bitter,Adult Detention Center,adult rash in winter,adult rash in inner,Adult Detention Center not,adult rash in inner thigh,Adult Detention Center North
bitter,adult attention to better,adult attention 2 better,adult attention to bed,adult attention to dinner,adult attention to banner,
sweet,whiskey sour wasn't very sweet,whiskey sour a wasn't very sweet,do whiskey sour wasn't very sweet,whiskey sour suite,whiskey sour Aries suites,whiskey sour sweet
sweet,that was the sower is very sweet,that was the sour is very sweet,that was Keith Harrow is very sweet,that was the Pharaoh is very sweet,that was bizarre is very sweet,that was the sower is very suite
alcoholic,that whiskey sour Tron,that whiskey sour wasn't Ron,that whiskey sour wasn't Rana,that whiskey sour strong,that whiskey sour wasnt Rana,that whiskey sour wasn't strong
alcoholic,that whiskey sour is too strong,that whiskey sours to Strong,that whiskey sour with to Strong,that whiskey sour is to Strong,that whiskey sours to stronger,that whiskey sour to Strong
sour,episkey sour was in Santa Ana,episkey Sauer was in Santa Ana,episkey Sour was in Santa Ana,episkey Center was in Santa Ana,episkey Center 1 sour,episkey center was in Santa Ana
sour,whiskey sour Rosemary's hour,whiskey sour rosemary sour,whiskey sour rosemary Sauer,whiskey sour rosemary Sour,whiskey sour Rosemary's our,whiskey sour Rosemary's sour
