sweet,the gin Rickey wasn't sweet enough,the gin Rickey wasn sweet enough,the gin Rickey was in sweet enough,the gin review wasn't sweet enough,the gin Rickey wasn't sweetener,the gin Rickey wasn't suite in F
sweet,the gin Rickey shouldn't be so sweet,the gin rickeys shouldn't be so sweet,the gin Rickey shouldn't be 6 weeks,the gin Rickey shouldn't be sweet,the gin Rickey shouldn't be so Suite,the gin Rickey shouldn't be 6 week
alcoholic,that gin Rickey was not alcohol,that gin Rickey was not an alcoholic,that gin Rickey was not an alcoholic anon,that gin Rickey was not alcohol content,that gin Rickey was not alcoholic anon,that gin Rickey was not an alcoholic anonymous
alcoholic,gin Rickey is too strong,gin rickeys to Strong,generic used to Strong,generic use to Strong,gin Rickey to Strong,gin Rickey used to Strong
sour,gin Rickey 1 hour,Janicki 1 hour,gin Rickey,gin Rickey power,Jimmy Fallon,gin Rickey one hour
sour,the gin Rickey should be less sour,the gin Rickey should be less power,Dictionary should be less sour,the gin Rickey should be less hours,degenerative should be less sour,dictionary should be less sour
carbonated,the gin Rickey was in Indiana,the gin Rickey what is enough,the gin Rickey was Indiana,the gin Rickey was in the Siena,the gin Rickey was in the NFL,the gin review was in Indiana
carbonated,gin Rickey was to carbonated,the gin Rickey was to carbonated,gin Rickey was too carbonated,the gin Rickey was too carbonated,Janicki was to carbonated,Janicki was too carbonated
sweet,Electric lemonade very sweet,Electric lemonade Aries suites,Electric lemonade freeze meat,dielectric 18 very sweet,Electric lemonade Perry's meat,dielectric 98 very sweet
sweet,Electric lemonade shouldn't be so sweet,Electric lemonade shouldn't BCS Sweet,Electric lemonade shouldnt BCS Sweet,Electric lemonade shouldn't be so Suite,Electric lemonade shouldn't be since we,Electric lemonade shouldn't be 6 weeks
alcoholic,Electric lemonade stand strong,Electric lemonade and strong,Electric lemonade strong,Electric lemonade Strong,Electric lemonade frozen Strong,Electric lemonade stand strong enough
alcoholic,Electric lemonade is too strong,the electric Naples to Strong,electric Naples to Strong,do you have to clean a is too strong,Electric Company is too strong,electric companies is too strong
sour,the electric man in a very sour,the electric man it was in Paris tower,the electric man it was in Paris hour,the electric man in Paris tower,the electric man in Paris hour,the electric man it was in Paris power
sour,Electric my name is really sour,dielectric my name is really sour,the electric my name is really sour,electric my name is really sour,Electric my name is really Sauer,Electric my name is really Sour
sweet,Long Island iced tea wasn't sweetener,Long Island Iced Tea wasn't sweetener,Long Island iced tea sweet,Long Island iced tea sweet nothing,Long Island iced tea sweetness,Long Island iced tea wasn't sweet
sweet,my Long Island iced tea is too sweet,my Long Island iced tea was too sweet,my Long Island iced teas too sweet,my Long Island iced tea with 2 suite,my Long Island iced tea with too sweet,my Long Island iced teas to suite
alcoholic,my Long Island Iced Tea have enough alcohol,my Long Island iced tea have enough alcohol,my Long Island iced teas Avenue El Cajon,my Long Island iced tea Avenue El Cajon,my Long Island Iced Tea Avenue El Cajon,my Long Island iced tea to Avenue El Cajon
alcoholic,my Long Island iced tea should have been week,my Long Island iced tea should have been weak,my Long Island iced tea should have been Rica,my Long Island iced tea should have been leaked,my Long Island iced tea should have been Week,my Long Island iced tea should a fan week
sour,Long Island iced tea should be more sour,Long Island iced tea should be more salary,Long Island iced tea should be more Sauer,Long Island iced tea should be more sound,Long Island iced tea should be more Sour,
sour,Long Island iced tea 2000,Long Island iced teas to self,Long Island iced teas to sell,Long Island iced tea Tucson,Long Island iced tea 27,
carbonated,Long Island iced tea was Indiana,Long Island iced tea was in Indiana,Long Island iced tea wasn't enough,Long Island iced tea was in the NFL,Long Island Iced Tea wasn't enough,Long Island iced tea was in Siena
carbonated,Long Island iced teas to bubbly,Long Island iced teas to Bob Lee,Long Island iced teas to Bob ley,Long Island iced teas to Buckley,Long Island iced teas to Bali,
sweet,Moscow Mule mugs in Sweden,Moscow Mule mugs and Suites,Moscow Mule 1300,Moscow Mule Sweden,Moscow Mule,
sweet,Moscow Mule shouldn't be so sweet,Moscow mules shouldn't be so sweet,Moscow Mule shouldn't be so Suite,Moscow Mule shouldn't be so sweet I,Moscow mules shouldn't be so Suite,Moscow Mule in shouldn't be so sweet
alcoholic,Moscow Mule 2 week,Moscow Mule what is 2 week,Moscow Mule two week,Moscow Mule is 2 week,Moscow Mule is too weak,Moscow Mule is two week
alcoholic,Moscow Mule shouldn't have so much alcohol,Moscow mules shouldn't have so much alcohol,Moscow Mule shouldn't have alcohol,Moscow Mule shouldn't have so much alchohol,Moscow News shouldn't have so much alcohol,Moscow mules shouldn't have alcohol
sour,Moscone new tower,Moscow new tower,Moscow Mule in Santa Ana,Moscone new tower in a,Moscow Niall Horan,Moscone new towers
sour,Moscow Mule to sell for me,Moscow Mule to set alarm for me,Moscow Mule to self from me,Moscow mules to sell for me,Moscow mules to set alarm for me,Moscow Mule to send me
carbonated,Moscow Mule what is enough,Moscow Mule Xena,Moscow Mule what is in a,Moscow Mule what is en a,Moscow Mule Zena,Moscow Mule mugs Xena
carbonated,Moscow Mule is 250,Moscow mules is 250,Moscow Mule is 2:50,Moscow Mule is to 50,Moscow Mule ways to 50,Moscow mules 2:50
sweet,the running who wasn't very sweet,The Running who wasn't very sweet,the Roman who wasn't very sweet,the run in who wasn't very sweet,the running who was in suite,the running who wasn't very sweet tea
sweet,running way too sweet,what running way too sweet,running way to sweet,what running way to sweet,running way to suite,what running way to suite
alcoholic,that running needs more alcohol,that running brook needs more alcohol,that run in needs more alcohol,that run Inn needs more alcohol,that run into needs more alcohol,that running needs more alchohol
alcoholic,the running coach be weaker,the running coach the weaker,the running coach of the week,the running coach be weak,the running coach The Weeknd,the running coach the week
carbonated,my running who was in carpet is enough,my running who was in competition,my running who was in carbon is enough,my running who was in competition up,my running who was in competition on,my running who was in competition Us
carbonated,Myron cope with two carbonated,my running to carbonated,Myron cope with to carbonated,Myron cope with 2 carbonated,Myron to carbonated,Myron's to carbonated
sweet,Tom Collins wasn't very sweet,Tom Collins was very sweet,Tom Collins wasn't very suite,toms pawn wasn't very sweet,Tom Collins wasn't very Suite,Tom Collins wasn't very sweet tea
sweet,Tom Collins was really sweet,Tom Collins was really suite,Tom Collins was really Suite,Tom Collins was really sweet tea,Tom Collins was released suite,Tom Collins was released Suite
alcoholic,Tom Collins didn't have enough alcohol,Tom Collins doesn't have enough alcohol,Tom Collins does not have enough alcohol,Tom Collins didn't have enough alchohol,Tom Conti didn't have enough alcohol,Tom Collins didn't have enough to haul
alcoholic,the Tontons is too strong,the Tontons for is too strong,the Tontons to Strong,the Tontons was to Strong,the Tontons pearls to Strong,the Tontons with to Strong
sour,Tom Collins was in Fahrenheit,Tom Collins was in farenheit,Tom Collins wasn't hour and a half,Tom Collins wasn't Sauron,Tom Collins how are in a,Tom Collins weather how are in a
sour,Tom Collins is way too sour,Tom Collins way too sour,Tom Collins way to seller,Tom Collins way to store,Tom Collins way to cellar,Tom Collins way to say
carbonated,the Tom Collins carbones Edina,the Tom Collins was in carbonated in a,the Tom Collins was in carbonated,the Tom Collins was in carbonated enough,the Tom Collins was in carbonated Ana,the Tom Collins carbonated in a
carbonated,the town homes had too many bubbles,the townhomes had too many bubbles,the temptones had too many bubbles,the dump on had too many bubbles,the dump Hans had too many bubbles,Hans had too many bubbles
sweet,the screwdriver with sweet enough,the screw driver license Louisiana,the screw driver license WI tonight,the screw driver license Rihanna,the screwdriver with me tonight,
sweet,screwdrivers too sweet,screwdrivers to sweet,screwdrivers 2 suite,the screwdrivers too sweet,screwdrivers to suite,screwdrivers to Sweet
alcoholic,screwdrivers very weak,screwdrivers berry week,the screwdrivers very weak,screw drivers berry week,screwdriver with very weak,screwdrivers very Week
alcoholic,screwdrivers too strong,screwdrivers to strong,screwdrivers to Strong,screw drivers too strong,screwdrivers to stone,screw drivers to strong
sour,the screwdriver was in town,the screwdriver 1000,the screwdriver 1 sound,the screwdriver 1 south,the screwdriver 1 salary,the screwdriver in was in town
sour,my screwdrivers to self,my screwdriver to self,my screw drivers to self,my screwdrivers to sell,screwdrivers to self,my screwdrivers to cell
sweet,fat people very sweet,that people very sweet,very sweet,fat people very suite,fat people Terry Smith,fat people Terry suite
sweet,Peace Corps shouldn't be that sweet,peaceful shouldn't be that sweet,Pisco shouldn't be that sweet,peacecorps shouldn't be that sweet,Peace Corps shouldn't be that suite,Peace Corps shouldn't be that Suite
alcoholic,MP skull strong,MP skull stronger,MP skull whats the strongest,happy School strong,MP skull what is strong,MP skull what is stronger
alcoholic,tattoo school is too strong,tattoo schools to Strong,,,,
carbonated,the Peace Corps needs more bubbles,MP skull needs more bubbles,the peace core needs more bubbles,the Peace Corps needs more Bubbles,MP skull needs more Bubbles,the Peace Corps needs more bottles
carbonated,MP skull was too busy,MP skull is too busy,the Peace Corps was too busy,MP skull is 250,the Peace Corps is too busy,Tempe schools was too busy
sweet,vodka tonic wasn't very sweet,define catatonic wasn't very sweet,vodka tonic wasn't very suite,vodka tonic wasn't very Suite,define catatonic wasn't very suite,vodka tonic wasn't very sweet tea
sweet,vodka tonic is too sweet,vodka tonic is 2 suite,vodka tonic is to suite,vodka tonic is to Sweet,vodka tonic is to Suite,vodka tonic is 2 Suite
alcoholic,vodka tonic needs more alcohol,vodka tonic me tomorrow,vodka tonic needs more,vodka tonic needs more alcoholic,vodka tonic needs more alchol,vodka tonics me tomorrow
alcoholic,vodka tonic what is way too strong,vodka tonic is way too strong,vodka tonic was way too strong,Batman katana was way too strong,vodka tonics was way too strong,vodka tonic was way to Strong
sour,vodka tonic went sour,define catatonic wasn't Sauer,vodka tonic wasn't Sauer,define catatonic wasn't Sour,vodka tonic wasn't Sour,vodka tonic went Sauer
sour,Fontana to self,fat pocket on a tooth out,fat pocket on a 2000,Fontana to sell,Fontana to sale,fat Fontana to self
carbonated,vodka tonic needs more carbonation,,,,,
carbonated,vodka tonic is 250,vodka tonic with two fish,vodka tonic with two faces,vodka tonic with 26,vodka tonic with to fish,vodka tonic is to fish
sweet,Pisco Sour was in Sweden,pisco sour was in Sweden,Pisco Sour was in Swedish,pisco sour was in Swedish,Pisco Sour was in sweet,pisco sour was in sweet
sweet,the Pisco Sour is very very sweet,Pisco Sour is very very sweet,pisco sour is very very sweet,the pisco sour is very very sweet,pisco sour with very very sweet,the pisco sour with very very sweet
alcoholic,pisco sour should be strong,pisco sour should be stronger,pisco sour should the strong,pisco sour should be Strong,the PJs go sour should be strong,pisco sour should be strong for
alcoholic,Pisco Sour needs to be weaker,pisco sour needs to be weaker,pisco sours needs to be weaker,Pisco Sour needs to be liquor,pisco sour needs to be liquor,Pisco Sour needs to be wicker
sour,Pisco Sour needs to,pisco sour needs to,pisco sour,Pisco Sour need,Pisco Sour need to,pisco sour need
sour,pisco sour Tucson,Pizza sounds to self,pisco sour 27,pisco sour is 27,Pisco Sour to self,Pisco Sour me to self
sweet,margarita with sweet,margarita with weed,margarita with suites,margarita with suite,margarita,
sweet,my margarita is too sweet,my margaritas to sweet,my margaritas 2 suite,my margaritas is too sweet,my margaritas to suite,my Margarito is too sweet
alcoholic,my margarita should have been stronger,my margaritas should have been stronger,my margaritta should have been stronger,my margharita should have been stronger,my margarita should have been strong,my margarita should have been stronger a
alcoholic,my margarita needs to be weaker,my margaritas needs to be weaker,buy margaritas needs to be weaker,my mind reading needs to be weaker,my mind reader needs to be weaker,my margarita needs to be weekend
sour,margarita with Corona,margarita with a corona,margarita what are in a,Margarito what are in a,Margarida what are in a,margarita with sirens
sour,margaritas to sour,margaritas to Sauer,margaritas to Sour,margaritas to sower,margaritas to seller,
sweet,Arkansas hunting license,Arkansas,Tarkan swimming lessons,darken swimming lessons,Arkansas running speed,Arkansas hunting licence
sweet,constraints too sweet,constraints to sweet,constrain too sweet,constraints 2 suite,scream 2 suite,constrain to sweet
alcoholic,13 stories didn't have enough alcohol,13 stories didn't have alcohol,13 stories did not have enough alcohol,13 stories didn't have an alcohol,13 stories didn't have enough alchohol,13 stories didn't have alchohol
alcoholic,dark and stormy way too much alcohol,dark and stormy way too much alchol,dark and stormy way too much alchohol,dark and stormy way too much alcohol cause,dark and stormy way too much alcohal,
carbonated,Target store in the needs more carbonation,Duncan store in the needs more carbonation,drunken store in the needs more carbonation,Target store in the needs more combination,Duncan store in the needs more combination,Target store in the needs more combinations
carbonated,dark and stormy shouldn't have so much carbonation,dark and stormy shouldn't have so much for the nation,dark and stormy shouldn't have so much for the nations,dark and stormy shouldn't have so much for the Nation,dark storm shouldn't have so much carbonation,dirty story shouldn't have so much carbonation
sweet,the gin buck was in Sweden,the gin buck with me tonight,the gin buck with sweet enough,the gin buck was in Swedish,the gym equipment sweetener,the gin buck wasn't sweetener
sweet,fat teen f*** is too sweet,fat teen f*** is 2 suite,fat teen f*** is too sweetie,fat teen f*** is to suite,fat teen f*** is to Sweet,fat teen f*** is to Suite
alcoholic,Ginbot,gin buck,Ginbot DC,gin bucket list,that's in the Beast,Ginbot Beast
alcoholic,patent ductus to be weaker,patent ductus the weaker,inductive to be weaker,Dotson puppies to be weaker,that's inductees to be weaker,tattooed on his to be weaker
carbonated,Gymbox needs to be sexier,Gymbox needs to pieces,Jim buck needs to be sexier,Gymbox needs to pee,Jim buck needs to pieces,Genbook needs to be sexier
carbonated,regions should be so busy,the gin should be so busy,Regions Bank should be so busy,engine should be so busy,region should be so busy,regions should be so easy
sweet,tequila sunrise very sweet,Tequila Sunrise lesson 3 suite,tequila sunrise Pleasant Prairie Sweet,Tequila Sunrise lesson 3 speed,Tequila Sunrise legendary suite,tequila sunrise Pleasant Prairie Street
sweet,Tequila Sunrise is way too sweet,tequila sunrise is way too sweet,tequila sunrises way too sweet,tequila sunrises way to sweet,tequila sunrises way to suite,Tequila Sunrise the way too sweet
alcoholic,Tequila Sunrise should be stronger,,,,,
alcoholic,tequila sunrise,Tequila Sunrise,tequila sunrise wasn't,tequila sunrise was,tequila sunrise wasnt,tequila sunrise what
sour,tequila sunrise,Tequila Sunrise,,,,
sour,tequila sunrises to sour,tequila sunrises to center,tequila sunrises to self,tequila sunrises to Center,tequila sunrises 27,Tequila Sunrise to sour
alcoholic,bourbon and water should be,bourbon and water should be me,bourbon and water should be you,bourbon and water should be with,the Bourbon in water should be,bourbon in water should be
alcoholic,bourbon and water wizz to alcohol,bourbon and water wizz to El Cajon,bourbon and water Vista to alcohol,bourbon and water wizz to alcoholic,bourbon and water wizz to alcoholics,bourbon and water wizz to alchohol
sweet,the Roy Rogers should be sweeter,,,,,
sweet,the Roy Rogers is too sweet,the Roy Rogers was too sweet,the Roy Rogers too sweet,the Roy Rogers Bros 2 suite,the Roy Rogers 2 suite,the Roy Rogers was 2 suite
carbonated,Roy Rogers needs more carbonation,Roy Rogers needs more combination,Roy Rogers needs more combinations,Roy Rogers needs mark combination,Roy Rogers needs mark combinations,Roy Rogers needs Mark combination
carbonated,Roy Rogers should be less carbon,Roy Rogers should be less carpet,Roy Rogers should be less carbs,Roy Rogers should be less Carbon,Roy Rogers should be less carpet Inn,Roy Rogers should be left Carbon
sweet,remind a raise in Sweden,reminder restaurants in Sweden,remind a race was in Sweden,remind a razor was in Sweden,reminder race was in Sweden,remind restaurants in Sweden
sweet,make me a sweet Black Russian,make me a sweep Black Russian,make me a suite Black Russian,make me a sweet black Russians,make me a sweetie Black Russian,make me a sandwich Black Russian
sweet,make me a Black Russian sweet,make me a Black Russian,make me a Black Russian suite,make me a Black Russian tweet,make me a black Russians suite,
alcoholic,make me a strong Black Russian,make me a strong black Russians,make me a stronger Black Russian,make me a strong black Russia,make me a stronge Black Russian,make me a strong black rush in
alcoholic,wake me up Black Russian with lots of alcohol,make me up Black Russian with lots of alcohol,wake me up Black Russian with lots of alchohol,make me up Black Russian with lots of alchohol,wake me up Black Russian with lots of alcohols,make me up Black Russian with lots of alcohols
creamy,make me a creamy Black Russian,make me a creamy black Russian,make me a creamy black Russians,make me a creamy black Russia,make me a creamy black rush in,
creamy,make me a Black Russian with lots of cream,make me a Black Russian supreme,make me a Black Russian Supreme,make me a Black Russian cream,make me a Black Russian the cream,
sweet,I'd like a sweet white russian,I'd like a sweet White Russian,I'd like a suite White Russian,I'd like a sweet White Russians,I'd like a sweet white Russia,I'd like a suite White Russians
sweet,make me a sweet white russian,make me a sweet White Russian,make me a suite White Russian,make me a sweep White Russian,make me a sweet White Russians,make me a suite White Russians
alcoholic,make me a strong White Russian,make me a strong white russian,make me a stronge White Russian,make me a stronger White Russian,make me a straw White Russian,make me a strong White Russians
alcoholic,like a strong White Russian,like a strong white russian,like a strong acid,like a stronge White Russian,like a strong white recipe,like a strong White Russians
creamy,make me a creamy white russian,make me a creamy White Russian,make me a creamy white recipe,make me a creepy White Russian,make me a creamy white recipes,make me a creamy white Russia
creamy,I want to create a White Russian,I want to cry me a White Russian,I want a creamy white russian,I want a creamy a White Russian,I want to clean a White Russian,I want a creamy white Russia
sweet,make me a sweet old fashioned,make me a sweet old fashion,make it sweet old fashioned,make me a sweet old fashions,make me a suite old fashioned,make me a sweep old fashioned
sweet,I like a sweet old fashioned,I like a sweet old fashion,I like a sweet old fashions,I like is a sweet old fashioned,I like is a sweet old fashion,I like is a sweet old fashions
alcoholic,I want a strong old fashioned,I want a strong old fashion,I want a strong willed fashion,I want a strong willed fashions,I want a strong fashions,I want a strong willed Fashion
alcoholic,I want an old fashioned make it strong,I want an old fashioned make it stronger,I want an old fashioned make its wrong,I want an old fashioned Megatron,I want an old fashioned make a strong,I want an old fashioned in make it strong
bitter,I want a bitter old fashioned,I want a bitter old fashion,I want a better old fashioned,I want a better old fashion,I want a bitter old fashions,I want to bitr old fashioned
bitter,like a bitter old fashioned,I like a bitter old fashioned,like a bitter old fashion,I like a bitter old fashion,like a better old fashioned,I like a better old fashioned
sweet,like a sweet whiskey sour,like a sweet whisky sour,like a suite whisky sour,like a suite whiskey sour,Leica suite whisky sour,Leica suite whiskey sour
sweet,I want a sweet whiskey sour,I want to sweet whiskey sour,I want to sleep with the sower,,,
alcoholic,like a strong whiskey sour,I like a strong whiskey sour,like a strong whisky sour,I like a strong whisky sour,like a stronge whiskey sour,stronge whiskey sour
alcoholic,I want a strong whiskey sour,I want a strong whisky sour,I want a stronge whiskey sour,I want a strong with the sower,I want a stronge whisky sour,
sour,I'd like a sour whiskey sour,I'd like a sour whiskey sours,I'd like a shower with the sower,I'd like a shower with you,I'd like a a sour whiskey sour,I'd like a shower with diesel
sour,like a sour whiskey sour,like a a sour whiskey sour,Leica a sour whiskey sour,like a shower with the sower,likea a sour whiskey sour,Michael a sour whiskey sour
sweet,I want to switch in Ricky,I want to switch and Ricky,I want to Sweet Chin Rickey,I want to switch in wiki,I want to switch in Reiki,I want to switch in Rickey
sweet,make me a sweet gin Rickey,make me a suite gin Rickey,make me a sandwich in wiki,make me a sandwich in Ricky,make me a sandwich in Rocky,make me a sandwich in Ricki
alcoholic,I want a strong gin Rickey,I want a strong gin Ricky,I want a strong gen Ricky,I want a strong Jen Ricky,I want a strong engine Ricky,I want a stronge gin Rickey
alcoholic,Vigen Ricky make it strong,virgin Ricky make it strong,Virgin Ricky make it strong,vagina Ricky make it strong,Vigen Ricky make it stronger,urgent Ricky make it strong
sour,I have a sour gin Rickey,how have a sour gin Rickey,I have a sour gin Ricky,how have a sour gin Ricky,I have a sour gen Ricky,I have a sour GYN Ricky
sour,make me a sandwich and Ricky,make me a sandwich in Reiki,make me a sandwich in Ricky,make me a sandwich in Rocky,make me a sandwich in reg E,
carbonated,I want a fizzy gin Rickey,I wanna fizzy gin Rickey,I want to see the gin Rickey,I want to fizzy gin Rickey,I want to 50 gin Rickey,I want to visit gin Rickey
carbonated,make me a carbonated gin Rickey,make me a carbonated jenneke,make me a carbonated gen Ricky,make me a carbonated Jen Ricky,make me a carbonated Ricky,make me a carbonated Jenna Ricky
sweet,make me a sweet Electric lemonade,make me a suite Electric lemonade,make me a sandwich Electric lemonade,make me a sweep Electric lemonade,make me a sweet Electric Lemonade,make me a sweet electric Lemonade
sweet,call have an electric lemonade,call have an electric lemonade sweet,call have an electric lemonade and Suites,call have an electric lemonade suite,call have an electric lemonade and sweet,call have an electric laminated sweet
alcoholic,make me an Al coholic,make me an Al coholic a,make me an Al coholic A,,,
alcoholic,make me a strong electric lemonade,make me a strong electric Lemonade,make me a strong electric limited,make me a strong electric laminated,make me a strong electric Limited,
sour,make me a star electric lemonade,make me a star electric,make me a star electric lemon,make me a star electric limit,make me a star electric women,
sour,all have a sour Electric lemonade,all have a sour electric Lemonade,all have a sour electric limited,all have a sour Electric Lemonade,all have a sour Electric limited,all have a sour electric Limited
sweet,make me a sweet Long Island iced tea,make me a suite Long Island iced tea,make me a sweet long island ice tea,make me a sweep Long Island iced tea,make me a suite Long Island Iced Tea,make me a suite Long Island ice-t
sweet,I have a sweet Long Island iced tea,I have a suite Long Island iced tea,I have a sweet long island ice tea,I have a suite Long Island Iced Tea,I have a sweet Long Island Iced Tea,I have a sweet long island ice T
alcoholic,get me a strong Long Island iced,get me a strong Long Island,get me a strong Long Island iced tea,get me a strong long island ice,get me a strong Long Island ice,get me a stronge Long Island
alcoholic,I want a strong Long Island iced tea,I want a strong long island ice tea,I want a strong Long Island Iced Tea,I want a stronger Long Island iced tea,I want a strong is Long Island iced tea,I want a stronge Long Island iced tea
sour,give me a sour Long Island iced tea,give me a sour long island ice tea,give me a sour Long Island Iced Tea,give me a sourdough Long Island iced tea,give me a sour Long Island iced teas,give me a sour long island ice T
sour,make me a star Long Island iced tea,make me a salad Long Island iced tea,make me a star Long Island Iced Tea,make me a star Long Island ice-t,make me a sound Long Island iced tea,make me a star Long Island iced teas
