sweet,that wasn't nearly sweet,that wasn't nearly sweetener,that wasn't nearly Suites,that wasn't nearly sweet,that wasn't nearly sweetheart,that wasn nearly sweet
sweet,that was in Sweden,Sweden,sweet,that wasn't sweetener,sweetheart,that wasn't sweetheart
sweet,very sweet,very suite,very Suite,Barry suite,very sweet tea,sweet
sweet,should have been sweeter,insurance in sweeter,Insurance sweeter,Insurance wheather,insurance sweeter,insurance wheather
sweet,I like it sweeter,I like it sweet,I like it's winter,I like it sweetheart,get sweeter,I like it sweeter much
sweet,sweeter next time,can sweet next time,sweetheart next time,sweeter next Time,can sweets next time,sweeter next time I
sweet,newly sweet enough,newly sweetener,nuely sweet enough,nooly sweet enough,newly sweetheart,newly Sweden
sweet,how much sweeter,how much sweetener,how much sweetheart,,,
sweet,that was much too sweet,what was much too sweet,how much too sweet,that was much to suite,what was much to suite,that was much to sweet
sweet,is too sweet for me,is too sweet to me,too sweet for me,is too sweet honey,is too sweet mi,too sweet to me
sweet,that was way too sweet,that was way too sweetie,that was way to suite,that was way to sweet,that was way to sweeten,
sweet,is too sweet,2 suite,is 2 suite,is too sweetie,is to suite,is to sweet
sweet,don't make it so sweet next time,don't make it so sweet. Next time,don't make it says we text I'm,don't make it says we text times,don't make it says we text Time,don't make it so sweet next times
sweet,is too sweet,what was too sweet,it was too sweet,what was too sweetie,it was too sweetie,is too sweetie
sweet,I was too sweet,how was too sweet,I was 2 suite,I was too sweetie,how was too sweetie,how was 2 suite
sweet,make it less sweet,make it less wheat,make it less suite,make it less Suite,make it less weed,make it last suite
sweet,make it less sweet next time,make it less sweet next Time,make it less sweet time,make it less sweet thyme,make it less sweet next times,make it less sweet Time
sweet,don't make it so sweet,don't make it sweet,don't make incense wheat,dont make incense wheat,don't make incense suite,dont make incense suite
bitter,make it more better,make it more bitter,make it work better,make it more wetter,make it more butter,
bitter,what is better enough,that wasn't better enough,that wasn't there enough,that wasn better enough,that was in better enough,better enough
bitter,it wasn't very better,it wasn't very bitter,it wasn't very butter,it wasn't very builder,it wasn't very bitter earth,
bitter,should be more better,should be more bitter,should be more butter,should be more wetter,should be more builder,Bmore builder
bitter,should be better,should be better off,should be bitter,should be better at,should be better on,
bitter,better enough,better enough for,,,,
bitter,I was to better,I was 2 better,that was to better,what was to better,2 better,I was too bitter
bitter,that was way to better,that was way too bitter,that was way to get ur,that was way to banner,that was way to batter,
bitter,make it better,make it less bitter,better,naked better,naked,make it bigger
bitter,to better,how to better,better,stupider,how to batter,YouTube editor
bitter,how to better for me,2 better for me,Jupiter from me,how to better from me,2 better from me,how to better for mi
bitter,next time does make it better,next time does make it feel better,next time does make it so bitter,next time does make it to dinner,next time does make it,
sour,Tucson,27,note to self,how to set,2000,
sour,Tucson,27,827,where to Santa,270,
sour,don't make it so sour,don't make it so Sauer,don't make it so Sour,don't make it so sower,don't make it 6 hour,don't make it says Sauer
sour,that was way too sour,that was way to sour,that was way to Sauer,that was way too Sauer,that was way to Sour,that was way too Sour
sour,Tucson,27,how to set,2sao,how to say,app Tucson
sour,how was too sour,I was too sour,how is too sour,,,
sour,make it less our next time,make it less our time,make it less hours time,make it less hour time,make it less sour times,make it last our next time
sour,naked 1 hour,naked shower,naked power,make it more salary,naked Power,power
sour,make it more sour,make it more Sauer,make it more Sour,make it more sower,make it more Schauer,naked morning Sauer
sour,next time,naked next time,making next time,Macon next time,make it next time,making more time
sour,that wasn't enough,that was in Fahrenheit,that was in Santa Ana,that was in farenheit,that wasn't hour and a half,
sour,nearly sour,nearly Sauer,nearly Sour,nearly sour enough,nearly Sauer enough,nearly Sour enough
sour,at 17,at 17 up,that one Santa Ana,at 17 a,817,
carbonated,bubbly,public,Publix,navigate to Publix,glee,
carbonated,do carbonated,carbonated,2 carbonate,carbonator,2 carbonated,YouTube carbonated
carbonated,that was to bubbly,that was to Bowie,that was to buy bully,that was too Bubba Lee,that was to buy Belize,that was to bubble Lee
carbonated,there is too much carbonation,where is too much carbonation,,,,
carbonated,do carbonated,carbonated,2 carbonate,2 carbon dated,two carbon dated,2 carbonated
carbonated,is to bubbly,is to believe,is to bully,is to Bali,is to Belize,used to believe
carbonated,is it was 250,is it was to 50,is it was too busy,is it with 250,is it was 2:50,is it was too fizzy
carbonated,don't make it so 50 times,don't make it so fat,don't make it so frizzy,don't make it so fast,don't make it so 50 time,
carbonated,250,215,252,258,,
carbonated,naked,Macon,making,Michigan,Megan,
carbonated,make it more fizzy,naked p****,make it more 50,naked 150,Naked City,making 150
carbonated,Indiana,Indian,Indian a,finding a,indian. A,that wasn't finding a
carbonated,Atmore Mobile,Atmore bubbles,at Moore mobile,Atmore mobile,Atmore bubble,Atmore Buble
carbonated,make it easier,naked videos,naked video,naked for the earth,,
carbonated,add more carbonation,,,,,
carbonated,that was flat,that was Flatt,that was flats,that was Flat,that was Flatts,that was the Flatt
carbonated,that was too flat,that was too flats,that was too Flatt,that was too flat iron,that was to Flatt,that was to flats
carbonated,make it more carbonated,,,,,
creamy,naked crazier,make it creamy your,make it crazier,naked crazy your,naked crazy you're,make it creamy York
creamy,that was in premium,that wasn premium,that wasn't premium,that wasn Premium,that wasn't Premium,that was in preemies
creamy,make it more creamy,make it work remix,naked creamy,make it work Remi,naked twerk Remi,naked creaming
creamy,creamy enough,creamy in a,creamy Ana,creamy una,creamy na,creemee enough
creamy,how did creamier,Heather creamier,hazard creamier,premeer,tethered creamier,how did cream ear
creamy,23 me,23,23 mean,23 mi,23 minutes,238 me
creamy,that was way too,that was way too greedy,that was way to creamy,that was way to freeze,that was way to me,
creamy,don't have it so crazy,don't have it so creepy,don't have it so creamy,don't have it so creatine,don't have it so cream,
creamy,don't make it so creamy,don't make it so crazy,don't make it so creepy,,,
alcoholic,navigate to strong,navigate to Strong,navigate to draw,navigate to stronger,,
alcoholic,much too strong,that was much too strong,how much too strong,that was much to Strong,how much to Strong,much too strung
alcoholic,that was way too strong,that was way too strung,that was way to Strong,that was way too strong for,that was way to scroll,
alcoholic,strong,what was the little strong,Tron,drunk,what was a little stronger,Strong
alcoholic,who is too strong,strong,who is to Strong,who is to draw,12 Strong,who is too strung
alcoholic,it had too much alcohol,it had to much alcohol,it had to much alchohol,it had to much alchol,,
alcoholic,there is too much alcohol,there was too much alcohol,there is too much alcohol in it,there was too much alcohol in it,where is too much alcohol,where is too much alcohol in it
alcoholic,don't have so much alcohol,don't have so much alchohol,,,,
alcoholic,it was too much alcohol,it was too much alchohol,it was too much alchol,it was too much album,it was too much Aleve,it was too much a album
alcoholic,make it stronger,,,,,
alcoholic,I like it stronger,I like a stronger,,,,
alcoholic,make it stronger next time,make it stronger next times,make it stronger next Time,make it stronger next time I,make it stronger text times,make it stronger text Time
alcoholic,should have been stronger,should've in stronger,should be in stronger,should in stronger,should ve in stronger,should have in stronger
alcoholic,it should be stronger next time,is the stronger the time,it should be stronger than a time,it should be stronger time,it should be stronger times,it should be stronger the time
alcoholic,alcohol,Oracle,alcoholic,alcohols,Atmore AL,
alcoholic,there wasn't enough alcohol,there wasn't enough alchohol,alcohol,there wasn't a nut alchohol,there wasn't another alchohol,there wasn't a knot alchohol
alcoholic,it wasn't Rana,strong enough,it wasnt Rana,it wasn't Strana,Strana,it wasnt Strana
good,I like that,I like to,I like dat,I like the,I like them,
good,I liked it,I like to,I like today,I like t***,I like it,
good,it was good,it was good for,it was good day,,,
good,good job,good jobs,good Jobs,jobs,job,
good,tasty,tastea,taste,pasty,tasting,
good,it was delicious,delicious,,,,
good,I loved it,I love it,I loved,"I loved it,",I love thee,I love did
good,I like today,I like to,I liked it,I like that,I like to do,
good,perfect,Hurst,hearth,Hearst,hurt,
good,perfect,Perfect,perfect two,perfect ass,perfect 2,
good,is great,great,Great,grate,rate,is grate
bad,I didn't like it,I didn't like,I didn't like it is,,,
bad,it's a,its a,Itza,it sucks,It's A,suck
bad,it was awful,it was awesome,the office,,,
bad,it was terrible,it was a terrible,it was Terrell,terrible,it was Terrible,Terrible
bad,that was gross,that was Groves,what was Groves,that was grouse,that was groves,what was grouse
bad,that was bad,bad,Bad,bade,that was that,Dallas bad
bad,that was horrible,horrible,that was 40,Horrible,oral,that was Horrible
bad,that was bad,that was that,is bad,is that,that was Bad,
bad,that was very bad,that was bad,that was very bad day,bad,that was very Bad,Bad
bad,I didn't like it all,I didn't like it at all,I did like it all,I didn't like a doll,I do not like it all,I do like it all
good,it was amazing,it was amazing I,,,,
good,it was wonderful,is wonderful,it was wonderful day,it was wonderful I,,
good,it was great,it was great day,it was Great,,,
good,unbelievable,,,,,
good,fantastic,fantasticc,Fantastic,Fantasticks,fantasti,
good,fantastic,send text,fantasti,fantasticc,test,
good,great,Great,grapes,rate,grate,
sweet,it was in Sweden,it wasn sweet,it wasn Suites,it was in Swedish,it wasn't sweet,it wasn suite
sweet,it was very sweet,it wasn't very sweet,sweet,it was very sweet tea,it wasn't very sweet tea,it was sweet
sweet,what should have been sweeter,what should have been sweetener,what should have been sweetheart,what should have ended sweeter,should have been a sweeter,what should have been a sweeter
sweet,it wasn't very sweet,it wasn't very suite,it wasn't very Suites,it wasn't very Suite,it wasn't very sweet tea,
sweet,it wasn't,it wasn't Sweden,it wasn't me,it wasnt,it wasnt Sweden,it wasnt me
sweet,it was too sweet,2 suite,it was 2 suite,it was too suite,it was to suite,it was to sweet
sweet,2 sweet,2 suite,2 Suite,to suite,to sweet,sweet
sweet,it was too sugary,it was to sugar free,it was too sugar free,,,
sweet,it was too sugary,Touche,Touche amore,it was too short,sushi,
sweet,there's too much sugar,,,,,
sweet,there wasn't enough sugar,there wasn't a no sugar,there wasn't enough Sugar,there wasn't enough suga,there wasn't enough Suga,there wasn't enough to Sugar
sweet,there wasn't enough sugar,sugar,where was internet Sugar,where was internet suga,there wasn't enough Sugar,there wasn't enough suga
carbonated,it wasn't for the night,it wasn't City,it wasnt City,it wasn't the Dina,it wasn't for the,it wasn't for dinner
carbonated,it wasn't for the enough,it wasn't fuzzy enough,it wasn't fizzy enough,it was Indiana,it wasnt fizzy enough,it wasn't City enough
carbonated,is 250,250,it was to 50,is 252,it was 2:50,is 2:50
carbonated,it was too busy,it was too fizzy,it was to fizzy,it was 250,is 250,it was to 50
carbonated,it wasn't Indiana,it wasn't for Indiana,it wasnt Indiana,it wasn t Indiana,it wasn't fuzzy enough,it wasn't city in us
carbonated,"it wasn't for the end up""",it wasn't for the NFL,it wasn't for the other,it wasn't for the endup,it wasn't for the end of,it wasn't for the end of the
carbonated,it wasn't city in us,it wasn't fuzzy enough,it wasn't for the enough,it wasnt city in us,it wasn city in us,it wasn't City enough
carbonated,it wasn't fuzzy enough,it wasn't for the enough,it wasn't his enough,it wasn't fizy enough,it wasn fizy enough,it wasnt fizy enough
carbonated,it wasn't fizzy enough,it wasnt fizzy enough,it wasn fizzy enough,it wasn't fizy enough,it wasn't fizzy Ana,it wasnt fizy enough
carbonated,it wasn't busy enough,it wasnt busy enough,it wasn busy enough,it wasn't busy and I,it wasn't busy in us,it wasnt busy and I
bitter,should be more better,what should be more better,should be more wetter,should be more bitter,what should be more wetter,what should be more bitter
bitter,it wasn't better enough,it wasnt better enough,it wasn better enough,it wasn't better in a,it wasn't veteran,it wasn't that are in a
bitter,it wasn't there enough,it wasn't bitter. Enough,it wasn't enough,it wasn't that are enough,it wasnt that are enough,wasn't that are enough
bitter,should have been more better,should have been more wetter,should have been more bitter,Ben Moore bitter,Ben Moore better,should have been more butter
bitter,it take to to better,it take to 2 better,it take to to banner,it take to to dinner,it take to to bitter,it takes to 2 better
bitter,is better,better,is bitter,Center,weather,Amazon better
bitter,2 better,to better,stupider,together,Tudor,
bitter,is to better,is 2 better,is too bitter,2 better,stupider,is Jupiter
sour,is to seller,is to self,is to salary,is to cellar,is 27,to seller
sour,it was really sour,it was really Sauer,it was really Sour,it was really sower,it was released Sauer,power
sour,it was too sour,it was too sour sauce,it was too sour soup,,,
sour,who was very sour,who was very Sauer,who was very Sour,who was very sower,who was very hour,who is Varys hour
alcoholic,it was too strong,too strong,to Strong,2 Strong,Everest too strong,two Strong
alcoholic,it was too strong,it was to Strong,it was too Strong,Strong,it was 20 Strong,
alcoholic,there is too much alcohol,where is too much alcohol,there is too much alchohol,where is too much alchohol,,
alcoholic,it was really strong,it was released wrong,it was really Strong,who was released wrong,who is released. Wrong,it was released Strong
sour,it wasn't sour enough,it wasn't Sauer enough,it wasnt sour enough,it wasn't Sour enough,it wasn sour enough,it wasnt Sauer enough
sour,it wasn't sour enough,it wasn sour enough,it wasn't Sauer enough,it wasnt sour enough,it wasn Sauer enough,it wasn't Sour enough
sour,should have been more sour,should have been more Sauer,should have been more Sour,should have been more sower,should have been more power,
sour,I like it more sour,I like it more Sauer,I like it more Sour,I like it more sower,I like it more Schauer,
sour,it wasn't very sour,it wasn't very Sauer,it wasn't very Sour,it wasn't very sower,Sauer,Sour
sour,it wasn't very sour,it wasn't very Sauer,it wasn't very Sour,it wasn't very sower,it wasn't Perry's Sauer,it wasn't Perry's Sour
alcoholic,it wasn't strong enough,it wasn strong enough,it wasnt strong enough,it was in strong enough,it was a strong enough,it was strong enough
alcoholic,it wasn't very strong,it wasn't very Strong,it wasn't married Strong,it wasnt married Strong,,
alcoholic,it wasn't very strong,it wasn't very Strong,Strong,it wasn't for Strong,Paris Strong,it was in Paris Strong
alcoholic,alcohol,NFL Hall,call,tonight alcohol,listen to know alcohol,listen to nothing at all
alcoholic,there wasn't enough alcohol,wasnt enough alcohol,that wasnt enough alcohol,there wasn't a non alcoholic,there wasn't enough alchohol,alcohol
alcoholic,that wasn't enough alcohol,there wasn't enough alcohol,that wasnt enough alcohol,alcohol,that wasn't enough alchohol,there wasn't enough alchohol
alcoholic,should be more alcohol,should be more alchohol,should be worn alchohol,should be born alchohol,should be one alchohol,should be 1 alchohol
alcoholic,strong enough,it was strong enough,it was the strong enough,,,
alcoholic,it wasn't strong enough,it wasn strong enough,it wasnt strong enough,it was in strong enough,it was instrumental,it was instrumentals
sweet,sweet enough,mi sweet enough,m sweet enough,M sweet enough,sweet enough for,mi sweet enough for
sweet,it wasn't very sweet,it was very sweet,it wasn't very suite,it wasn't very Suite,it wasn't very Suites,it wasn't very sweet tea
sweet,it wasn't very sweet,it wasn't very suite,it wasn't very Suite,it wasn't very sweet tea,it wasn't very Suites,
sweet,should be sweeter,,,,,
sweet,very sweet,very suite,very Suite,very Suites,very sweet tea,very. Suite
sweet,it was very sweet,it was very suite,it was very sweet tea,,,
sweet,it was too sweet,is 2 suite,it was too sweetie,it was too suite,is to suite,it was to suite
carbonated,is 250,is 215,is 252,250,is 250 F,
carbonated,is 250,250,is 250 F,is 252,is 250 R,
carbonated,it was too carbonated,it was to carbonated,it was 20 carbonated,it was to carbon dated,,
carbonated,it was too carbonated,it was to carbonated,it was to carbon dated,it was to Carver naked,it was to carbonate,how to carbonate
carbonated,it was very carbonated,it was very carbon dated,,,,
carbonated,very busy,very fizzy,very frizzy,Barry fizzy,is Barry fizzy,very easy
carbonated,it was very busy,it was a very busy,it was very fizzy,it was very frizzy,it was very busy bee,it was very easy
carbonated,it was to bubbly,it was to Bali,is to believe,it was to Buckley,is Tupac really,to believe
carbonated,it was very bubbly,it was very badly,it was very Bali,it was a Republican,Republic,
carbonated,it wasn't enough,it wasn't for the enough,it wasn't 50 enough,it wasnt 50 enough,it wasn't for these enough,it wasn't for the in us
carbonated,should be more 50,should be more fizzy,Bmore fizzy,450,Mr fizzy,engine 450
carbonated,beef is easier,beef is here,Vizio,beef is ear,should be physio,HEB physio
carbonated,it wasn't vizinha,it wasn't visina,it wasn't for the Ana,it wasnt vizinha,it wasn't vizina,it wasnt visina
carbonated,should be more carbonation,,,,,
carbonated,should be more carbonated,should be more carbon dated,,,,
carbonated,it wasn carbonated enough,it wasn't carbonated enough,it wasnt carbonated enough,it wasn carbinated enough,it wasn carbonate enough,it wasn carbonated in us
carbonated,it wasn't 50 enough,2050 enough,it wasn't 50 Ana,it wasnt 50 enough,it wasn 50 enough,2050 Ana
carbonated,it wasn't for the enough,it wasn't 50 enough,it wasn't city in us,it wasnt 50 enough,it wasn't fuzzy enough,it wasnt city in us
carbonated,it was in Atlanta,Atlanta,it wasn't Atlanta,it wasn't man enough,Lana,it wasnt Atlanta
carbonated,it was flat,flat,is flat,Flatt,Platt,it was Platt
carbonated,it tasted flat,tasted flat,it tasted flight,it tasted Flatts,it tasted flats,it tasted Flatt
carbonated,there is no carbonation,there's no combination,there is no carbonation in,,,
creamy,it wasn t me enough,it wasn t me in a,it wasn't premium,it wasn't premia,it wasn't Premium,it wasn premium
creamy,it wasn't enough,it wasnt enough,weather in a,it wasn't enough for,it wasn't me enough for,it wasnt me enough for
creamy,creamy enough,creamy in a,Premium,creamy Indiana,premium,creemee enough
creamy,it wasn't creamy enough,it wasnt creamy enough,it wasn creamy enough,it wasn't cream,it wasn't creamy Ana,it wasn't creamy in a
creamy,it wasn't thinking of,it wasn't thinking,it wasn't enough,it wasn't thinking about,it wasn't thinking out,
creamy,should have been creamier,should have been cream your,should have been cream year,should have been cream near,should have been cream in your,should have been Kreme year
creamy,what should be creamier,what should be creamy,what should be cream,what should be cream ear,what should be creamy layer,what should be creamy ear
creamy,is to creamy,is 23 me,creamy,is 23 mean,is to preemie,is too preemie
creamy,it was too creamy,it was to creamy,it was 23 me,is 23 me,it was too preemie,it was 23 B
creamy,very creamy,berry creamy,,,,
creamy,it was too creamy,it was to creamy,it was too Creamery,it was to Creamery,it was too cream,it was to cream
creamy,23 me,2 creamy,image to creamy,two creamy,to creamy,2k me
carbonated,is infinity enough,is Infiniti enough,it is in fizzy enough,citizen fizzy enough,it isn't fizzy enough,it is in Indiana
carbonated,it's not enough,it's not fair enough,it's not fit in a,its not fit in a,is not fair enough,it's not fit in us
carbonated,should have more carbonation,should have more combination,should have more combinations,should have won combination,should have worn combination,should have known combination
carbonated,the more carbonated,,,,,
alcoholic,should be stronger,should be strong,should be a stronger,should be strong odor,,
alcoholic,should be stronger,,,,,
sweet,should be sweeter,what should be sweeter,should be sweetener,what should be sweetener,,
sour,should be sour,should be Sauer,should be Sour,should be sower,should be Schauer,
sour,should be more sour,should be more Sauer,should be more Sour,should be more sower,should be more power,should be mark Sauer
sour,should be more sour,should be more Sauer,should be more Sour,should be more Center,should be more salary,should be Moore salary
sour,should be more,should be more power,should be more hour,should be more sour,should be worth,
sweet,sweet,suite,Suite,Sweet,wheat,
sweet,the more sweet,the more suite,the more Suite,the more Suites,the more Sweet,the MOR suite
sweet,should be sweeter,,,,,
sweet,should be more speed,should be more sweet,should be more suite,should be more Suite,should be more Speed,Bmore suite
bitter,be more better,be more bitter,be more wetter,the Moore bitter,the Moore better,the mower better
bitter,should be more better,what should be more better,should be more bitter,what should be more bitter,should be more wetter,what should be more wetter
bitter,what should be less bitter,what should be less better,what should be left better,what should be Lester,what should be Leicester,what should be less than air
bitter,should be less dinner,should be less bitter,should be left dinner,should be less than ur,should be less Dinner,should be left in ur
bitter,should be less bitter,should be less better,should be left center,should be left better,should be less Center,should be Lester
sweet,shouldn't be so sweet,shouldn't be so Suite,shouldn't be so suite,shouldn't be 6 weeks,shouldn't be so sweet I,
sweet,b****** be so sweet,b****** be so Suite,b****** be so suite,b****** be 6 feet,b****** be so sweet I,
sweet,should be less sweet,should be less suite,sweet,should be less weed,should be less Suite,should be left sweet
sweet,should be so sweet,should ve so sweet,should be so Suite,sweet,BCS Sweet,should ve so Suite
sour,NBC tower,,,,,
sour,shouldn't be this hour,shouldn't be the sower,shouldn't be the sour,shouldn't be the cellar,shouldn't be this our,
sour,should be less sour,should be less hour,should be less hours,should be less power,should be less our,should be left hour
carbonated,should be less carbonated,should be left carbonated,should be less carbonator,should be less carbon dated,should be less carbon,should be less carbon in it
carbonated,should be less busy,should be less lazy,should be less lazy eye,should be left at sea,should be less busy bee,
carbonated,should be physio,beef is you,should be fizzy,beef is easier,NBC's you,it's the fizzy
carbonated,should be physio,should be physic,should be fit,should be fizzy,should beef is you,should ve physio
creamy,should be creamier,should be cream near,should be creamy layer,should be creamy year,should be cream near me,should be creamy your
creamy,should be more creamy,should be more creamier,,,,
creamy,should be so creamy,,,,,
creamy,is to creamy,23 me,is 23 me,to creamy,is to create me,23 mean
creamy,should be less creamy,should be less clingy,should be less greasy,should be left creamy,should be like screaming,creamy
sour,should be less sour,should be less power,should be less hours,should be less hour,should be less Power,should be last hour
sour,should be less sour,should be less hour,should be less hours,should be less power,should be less our,should be left hour
bitter,should be less bitter,should be less better,should be left better,should be less pitter,should be left fielder,should be left fender
bitter,what should be less bitter,what should be less better,what should be less butter,what should be left better,what should be less Center,what should be less Banner
bitter,should be less bitter,should be less better,should be less pitter,should be left better,should be less filter,should be left fielder
sweet,should be less sweet,should be less Suites,should be less suite,should be less suites,should be left Suites,should be left suite
sweet,should be less sweet,should be less Suites,should be less week,should be less weed,should be less suite,should be left Suites
alcoholic,2 week,is two week,is 2 week,is too big,is to big,is 2 weeks
alcoholic,2 week,is two week,is 2 week,two week,is too weak,is 20 week
alcoholic,2 week,two week,20 week,2 weeks,two weeks,
alcoholic,it was pretty week,it was pretty Week,it was pretty weak,it was pretty weight,it was pretty weeks,
alcoholic,it was weak,it was week,it was Week,is weak,week,
