carbonated,make me a fizzy Long Island iced tea,make me a fizzy long island ice tea,make me a physio Long Island iced tea,make me a 50 Long Island iced tea,make me a fizzy Long Island Iced Tea,make me a fizzy Long Island ice-t
carbonated,I want a Long Island iced tea with lots of carbonation,I want a Long Island iced tea with lots of carbonate,I want a Long Island iced tea carbonated,I want a Long Island iced tea with lots of carbon,I want a Long Island iced tea carbonation,I want a Long Island iced tea with lots of carpet
sweet,make me a sweet Moscow Mule,make me a sweep Moscow Mule,make me a suite Moscow Mule,make me a sweet Moscow mules,make me a sweet Moscow mills,make me a sweep Moscow mules
sweet,I want to sweet Moscow Mule,I want to Sweet Moscow Mule,I want to sweep Moscow Mule,I want to sweet Moscow mules,I want to Sweet Moscow mules,I want to sweeten Moscow Mule
alcoholic,make me a strong Moscow Mule,make me a strong Moscow mules,make me a stronge Moscow Mule,make me a strong Moscow mills,make me a stronger Moscow Mule,make me a strong Moscone York
alcoholic,I want a strong Moscow Mule,I want a strong Moscow mules,Restaurant Moscow Mule,I want a strong New York,Astron Moscow Mule,stronge Moscow Mule
sour,I like a sour Moscow Mule,I'd like a sour Moscow Mule,I like a sour Moscow mules,Moscow Mule,I like a sour Moscow York,I'd like a sour Moscow mules
sour,make me a star Moscow Mule,make me a star Moscow mules,make me a star Moscow mills,make me a star Moscow Mills,,
carbonated,I want to visit Moscow Mule,I want to visit Moscow mules,I want to visit Moscow mills,,,
carbonated,like a Moscow Mule with lots of bubbles,like a Moscow Mule with lots of mobile,like a Moscow Mule with lots of bubble,like a Moscow Mule with lots of Mobile,like a Moscow Mule in the Bible,like a Moscow mules with lots of bubbles
sweet,take me a sweet rum and coke,take me to sweet rum and coke,wake me a sweet rum and coke,take me a sweet rum and koke,take me to sweet rum and koke,take me to a sweet rum and coke
sweet,I want to sweet rum and coke,I want to sweet rum and koke,I want to sweet rum and Coke,I want to sweet rum and Coca,I want to sweet rum and cokes,I want to sweet Rome and Coke
alcoholic,wake me up rum and coke make it strong,wake me up rum and coke make it stronger,wake me up rum and coke make a strong,wake me up rum and coke make it strong is,,
alcoholic,like a strong Roman coke,like a strong women coat,like a strong women quotes,like a strong woman coke,like a strong and coke,like a strong women coke
carbonated,give me a 50 Roman coke,give me a coke,give me a joke,give me a visit Roman coke,give me a video in Coke,give me a video Roman coke
carbonated,make me a carbonated drink Coke,make me a carbonated drink up,make me a carbonated Roman coke,make me a carbonated drink cup,make me a carbonated drink coke,make me a carbonated coke
sweet,make me a sweet Tom Collins,make me a suite Tom Collins,make me a sweep Tom Collins,make me a sweet om College,make me a sweet college,make me a suite in college
sweet,give me a sweet Tom Collins,give me a suite Tom Collins,give me a sweep Tom Collins,give me a sweet om College,give me a sweet om college,give me a suite of college
alcoholic,give me a strong Tom Collins,give me a strong compounds,give me a strong Tom Jones,give me a strong bones,give me a strong compound,give me a stronge Tom Collins
alcoholic,like a Tom Collins alcohol,like a Tom Collins,like a Tom Collins call,like a Tom Collins Colorado,like a Tom Collins all,
sour,make me a favour Tom Collins,make me a favor Tom Collins,make me a star Tom Collins,make me a favore Tom Collins,make me a favour time college,make me a favour time comes
sour,make a sour times,make a sour Tom Collins,make a sour compound,make a sour TomTom,make a sour time porn,make a seller Tom Collins
carbonated,give me a dollar,give me a call,give me a visit on power,give me a visit on college,give me a 50 times,give me a 50 top college
carbonated,I want a Tom Collins population,I want a Tom Collins what's the combination,I want a Tom Collins Venetian,I want a Tom Collins Avenue,I want a Tom Collins what's the population,
sweet,make me a screwdriver this week,make me a screwdriver that's sweet,make me a screwdriver the week,make me a screwdriver sweet,make me a screwdriver the suite,make me a screwdriver that's suite
sweet,make me a sweet Street,make me a sweet street,make me a sweet tree,make me a suites,make me a sweet River Drive,
alcoholic,make me a strong screwdriver,make me a strong screw driver,make me a stronge screwdriver,make me a strong odor,make me a stronger screwdriver,make me a strong screwdrivers
alcoholic,make me a screwdriver with alcohol,make me a screwdriver with lots of alcohol,making a screwdriver with alcohol,making a screwdriver with lots of alcohol,make me a screwdriver with alchohol,make me a screwdriver with Wacom
sour,make me a star screwdriver,make me a star screw driver,make me a favour screw driver,make me a favor screw driver,make me a sandwich screw driver,make me a favor and screwdriver
sour,I want to Sarah screwdriver,how are screwdriver,I want to sell screwdriver,how are screwdrivers,Harris Teeter,I want to send screwdriver
sweet,get me a sweep,get me a sweep school,give me a score,get me a sweep School,get me a sweep score,get me a sweet school
sweet,I want to Sweet Pea score,I want to sweet Peace Corps,I want to Sweet Peace Corps,I want to sweet peace core,I want to Sweet Pea scores,I want to Sweet Pea school
alcoholic,strong Peace Corps,what a strong Peace Corps,strong Peace Corp,what a strong base color,what a strong Peace Corp,what a strong base colour
alcoholic,make me a strong core,make me a strong score,make me a strong scores,make me a strong school,make me a strong the score,make me a stronger score
carbonated,what a fizzy Peace Corps,what a fizzy Peace Corp,what a fizzy peace core,what a fizzy Pisco,what a fizzy piece color,what a fizzy peace color
carbonated,like a preschooler with lots of carbonation,,,,,
sweet,make me a sandwich,wake me up,make me a sweep,make me a sweet frog,wake me up at 340,wake me at 340
sweet,I want to f*** a tonic,I want to f*** it on,I want to sweet frog a tonic,I want to f*** it on again,I want to f*** it on it,I want to f*** it on em
alcoholic,make me a strong vodka tonic,make me strong vodka tonic,make me a strong vodka tonics,make me strong vodka tonics,make me strong but katana,make me strong by katana
alcoholic,like a strong vodka tonic,like a strong vodka tonics,like a strong like it hot,like a strong like a tie,like a strong like a time,like a strong what is a time
sour,make me a servant Cattanach,make me a servant katana,make me a servant guitar,make me a servant to tonic,make me a servant to public,make me a servant ketotic
sour,I want to sell my guitar,I want to sell it on,I want to sell a time,I want to set a time,I want to set a timer,I want to set the time
carbonated,give me a video of Catan,give me a video,give me a video of Titanic,give me a video of time,give me a video of Kentucky,
carbonated,give me a vodka tonic,give me a vodka tonic very carbonated,give me a vodka tonic carbonated,give me a vodka tonic Avenue,give me a vodka tonic fairy carbonated,give me a vodka tonic very confident
sweet,make me a sweet sour,make it sweet sour,Mickey a sweet sour,making a sweet sour,Nicki a sweet sour,make me a sweet hour
sweet,like a pisco sour sweet,like a pisco sour suite,like a pisco sour sweets,like a pisco sour,a pisco sour sweet,a pisco sour suite
alcoholic,I want a strong tower,I want a strong hour,I want a strong power,I want a stronger power,I wanna Strong power,I want a stronge hour
alcoholic,make me strong Pisco Sour please,make me strong pisco sour please,make me strong Pisco Sour plea,make me strong pisco sour plea,make me strong Pisco Sour Pleas,make me strong pisco sour Pleas
sour,Srpska sour,Srpska Sauer,Srpska Sour,srpsko sour,srpsko Sauer,srpsko Sour
sour,pisco sour,pisco sour ferry,pisco sour fairy,pisco sour Perry,Pisco Sour ferry,Pisco Sour fairy
sweet,sweet margarita,margarita,sweet Margarita,sweet Margherita,Margherita,sweet Margarito
sweet,give me a margarita sweet peas,give me a margarita sweet,give me a margarita sweet breeze,give me a margarita sweet titties,give me a margarita Sweet Leaf,get me a margarita sweet peas
alcoholic,margarita strong,margaritas strong,margarita Strong,margaritas restaurant,strong,Korea strong
alcoholic,make me a strong margarita please,make me a strong margarita,make me a strong Margaritaville,make me a strong Margarita please,make me a strong Margarita police,make me a strong Margarita
sour,make me a star margarita,make me a star Margarita,make me a star Margherita,make me a star margaritas,make me a star Margaritas,
sour,margarita,Margarito,margaritas,Margherita,Margarita,Toyota margarita
sweet,give me a sweet dark and stormy,give me a sweet darken story,give me a sweet darken stories,give me a suite darken story,give me a sweet dark and stormy night,give me a sweet darken Story
sweet,get me a sweet Arkansas,get me a suite Arkansas,get me a sweet dark and stormy,get me a sweeter construction,get me a sweeter construct,get me a sweet I can start
alcoholic,strong dark and stormy,strong dark and stormy please,strong dark and stormy breeze,strong dark and stormy seas,strong dark and stormy lease,strong dark and Stormies lease
alcoholic,make me a dark and stormy with lots of alcohol,make me a dark and stormy,make me a dark and stormy a lot of alcohol,make me a dark and stormy Florida,make me a dark and stormy of water,make me a dark and stormy weather
carbonated,the dark and stormy,dark and stormy,is the dark and stormy,the dark and stormy seas,the dark and stormy please,naked dark and stormy
carbonated,like a bubbly dark and stormy,Michael Buble a dark and stormy,like a public dark and stormy,like a bubbling dark and stormy,like a bubble dark and stormy,like a bubbly dark and stormy night
sweet,make me a sandwich,make me a switch,make me a sandwich Denver,make me sweat,make me a sandwhich,make me a switch Denver
sweet,sweet Geneva,sweet,sweet box,I want to sleep,Suites in,I wanna sweet Geneva
alcoholic,wake me up strong Genbook,wake me up strong Jambox,wake me up strong Genbook please,make me a stronger in box,wake me up strong gin buck please,wake me up strong Jen bucks
alcoholic,I want a strong,I want a strong book,I want a strong box,strong,I want a strong word but,I wanna strong
carbonated,the Geneva,the gin buck,take me to the gym,take me to the gym bar,Mia the Geneva,take me to the gym bag
carbonated,McMechen buck with lots of bubbles,the kitchen buck with lots of bubbles,Muchin buck with lots of bubbles,take me to Jim buck with lots of bubbles,take me to Jen buck with lots of bubbles,McMechen buck with loss of mother
sweet,tequila sunrise,Tequila Sunrise,sweet tequila sunrise,tequila sunrise please,tequila sunrises,asleep tequila sunrise
sweet,ridiculous,ridiculous sunrise,ridiculousness,redickulous sunrise,like a sweet,ridiculous Sunrise
alcoholic,make me strong tequila sunrise,make me a strong tequila sunrise,make me strong Tequila Sunrise,make me a strong Tequila Sunrise,,
sour,make me a star tequila sunrise,make me a sandwich tequila sunrise,make me sound tequila sunrise,make me a servant tequila sunrise,make me a star Tequila Sunrise,make me a shout tequila sunrise
sweet,that wasn't enough,that wasn't good enough,that wasn't sweetener,that wasn't Sweden,that was in Sweden,that wasn sweetener
sweet,that was too sweet,that was 23,that was too suite,what was 23,that was too sweetie,that was too Suites
alcoholic,drink with strong enough,drink with a strong enough,drink with Corona,drink with stronger,drink wasn't stronger,drink with strong
alcoholic,is too strong,how is too strong,strong,how to Strong,how does to Strong,how is to Strong
bitter,Patrick was better not,Patrick was better now,drink with butternut,veterinary,Patrick was better,set wrinkle veterinary
bitter,drinks to better,drink with 2 better,petrichor to better,petrichor 2 better,drinking to better,drinkers 2 better
sour,that wasn't sour,that wasn't sourdough,that wasn't Sauer,that wasn't hours,that wasn't Sour,sourdough
sour,that drink with tooth out,that drink with 2000,that drink with 27,that drink with to self,that drink with two Center,that drink with to Center
carbonated,that wasn't vizinha,that wasn't visina,that wasn't Virgina,that wasn't vizina,that wasn't good enough,that wasn't for the NFL
carbonated,that was too busy,that was too fizzy,that was to fizzy,is 250,that was 250,Dallas 250
creamy,that wasn t me enough,that wasn't premium,that wasn't Premium,that was a criminal,that wasn't creamy Ana,that was a creamy Ana
creamy,72 cream,72 creamy,that was too creamy,72 Kreme,that was too cream,that was to cream
sweet,that drink with me tonight,that drink with sweetener,that drink with dinner,that drink with a straightener,that drink with sweet enough,
sweet,Patrick with too sweet,Patrick was too sweet,Patrick with two sweet,Patrick with 2 suite,Patrick with two suite,Patrick with to sweet
alcoholic,that wasn't strong enough,that wasn strong enough,that wasn't stronger,that wasn stronger,that wasn't strong enough to,that was in strong enough
alcoholic,is too strong,strong,how to Strong,72 Strong,two Strong,Strong
bitter,my drink was better now,my drink was better not,my drink was better enough,my drink was better in a,what drink was better now,what drink was better not
bitter,my drink with 2 better,my drink with to better,my drink with do better,my drink with you better,my drink is to better,my drink was to better
sour,my last drink with sour,my last drink with sourdough,my last drink with sirens,my last drink with Serena,my last drink with Sarah,
sour,my drink with 2000,2000,my drink with tooth out,my drink with 27,Madrid 2000,my drink with two thousand
carbonated,my last drink with carbonated,my last drink with a carbonated,my last drink was a carbonated,my last drink with a carbonate,my last drink with the carbonator,my last drink a carbonated
carbonated,my last drink with two carbonated,my last drink with 2 carbonated,my last drink with to carbonated,my last request to carbonated,my last drink to carbonated,my last drink with two carbon dated
creamy,my last drink with premium,my last drink wasn't premium,my last drink wasn't Premium,my last drink with a criminal,Electric wasn't premium,my last drink wasn't enough
creamy,the trick is to creamy,Federico's to creamy,Patrick was too creamy,the drink with two creamy,petrichor to creamy,the drink with to creamy
sweet,my drink was in Sweden,my drink,my drink was in,my drink with me tonight,my drink was it,
sweet,that wasn't very sweet,that wasn't very suite,that wasn't very Suite,that wasn't very sweet tea,that wasn't very sweet ass,
sweet,my drink was too sweet,my drink with too sweet,my drink with two sweet,my drink with 2 suite,my drink with 2 suites,my drink with two suite
alcoholic,my last drink very strong,my last drink with very strong,my last drink strong,my left ring Strong,my last drink Strong,my last train Strong
alcoholic,my last drink with too strong,my last drink with two strong,my last drink with two Strong,my last drink with to Strong,my last drink with 2 Strong,my last drink with a strong
bitter,that wasn't very bitter,that wasn't very better,that wasn't very butter,that wasn't very builder,that wasn't very better now,
bitter,my drink with very bitter,my drink with very better,my drink with Perry better,my drink with berry butter,my drinking Perry better,my drink was Perry better
sour,it was a very sour,it wasn't very sour,who was a very sour,it was a very Sauer,it was a very Sour,it wasn't very Sauer
sour,very sour,Woodbury Tower,Woodbury tower,Woodbury Sauer,Woodbury Sour,very Tower
carbonated,that wasn't very carbonated,that wasn't very carbonate,that wasn't very carbonator,that wasn't very Carbonite,that wasn't very Carbondale,
carbonated,very carbonated,Barry carbonated,Barry carbonate,very carbonate,Barry Carbondale,very Carbondale
creamy,that wasn't very creamy,that wasn't very creamy p****,what was the berry creamy,that wasn't very creamy goo,that wasn't very creamy eye,what was the berry creamy p****
creamy,that was very creamy,that was very creamy goo,that was very creamy eye,,,
sweet,that was very sweet,that wasn't very sweet,that wasn't very Suites,that wasn't very suite,that wasn't very suites,that was very sweet tea
sweet,my last drink should have been sweeter,my last drink should have been sweater,my last drink cinnamon sweeter,my last drink soda ban sweeter,my last drink should have been sweetheart,my last drink should have been 30
sweet,my last drink should a pencil,my last drink should the fences,my last drink should the Benson,my last drink should have been,my last drink Cinnabon,my last drink a pencil
alcoholic,drink with very strong,drink wasn't very strong,Electric wasn't very strong,string wasn't very strong,strength wasn't very strong,strings wasn't very strong
sweet,my last drink should have been sweeter,my last drink should have been sweater,my last drink should have been better,my last drink should have been spider,my last drink should have been sweetheart,my last drink should have been a spider
sweet,Electric should never been so sweet,electrician apprentice Beach,Electric should the fan supposed to be,Electric should the fan supposed to beat,Electric should the Benson Street,Electric shins Bensusan Beach
alcoholic,my last drink raspberry week,my last drink very weak,my last drink with very weak,my last drink raspberry Week,my last drink raspberry weak,my last drink a week
sweet,my last drink with sweet,my last drink with,my last drink with suites,my last drink with Sweden,my last drink water,my last drink was Sweden
sweet,that was way too sweet,what was way too sweet,that was way too sweetie,that was way to suite,that was way to sweeten,that was way to Sweet
alcoholic,that was too weak,what was too weak,what was two week,2 week,what was 2 week,what was 2 weeks
alcoholic,that was too strong,what was too strong,that was too Strong,that was too strung,that was to Strong,what was to Strong
bitter,my last drink should have been more,my last drink should have been more better,my last drink should have been more bed,my last drink should have been more bit,my last drink should have been more butts,my last drink should have been more a bed
bitter,my last drink should have been better,my last drink should have been a better,my last drink should have been a spitter,my last drink should have been master,my last drink should have been left center,my last drink soda ban master
sour,my last drink should have been more sour,my last drink should have been more Sauer,my last drink should have been more Sour,my last drink should have been more sower,my last drink should have been more Schauer,
sour,my last drink should have been blessed,my last drink should have been us,my last drink should have been love,my last drink should have been left out,my last drink should have been left side,
carbonated,drink carbonated enough,drink carbonated,drink carbonated tonight,drink carbonated mount,drink carbonated in,
carbonated,what was too carbonated,what was to carbonated,what was 2 carbonated,what was two carbonated,how to carbonate,what was to carbon dated
creamy,creamy enough,what was a criminal,Nicki Minaj,how was a criminal,criminal,Premium
creamy,my last drink with 2 cream,my last drink with two penis,my last drink with two cream,my last drink with 2 premiere,my last drink with to create,my last drink with two creamy
sweet,my last drink with sweet enough,my last drink with me tonight,my last drink with sweetener,my last drink with an A,my last drink with sweet in us,my last drink with a sweetener
sweet,should have been less sweet,should have been left Suites,should have been less weed,should have been left suite,should have been blessed week,should have been blessed Suites
alcoholic,what should have been stronger,,,,,
alcoholic,my last drink should have been weaker,my last drink should have been wicker,my last drink should have been weak,my last drink should have been weekend,my last drink soda ban weaker,my last drink should a fan weaker
bitter,that wasn't bitter.,that wasn't better,that wasn't enough,that wasn't theater,that wasn better,that wasn theater
bitter,my last ranker to better,my last drink with 2 better,my last drink to better,my last drink with to better,my last drink for to better,my last drink a to better
sour,that wasn't hours,that wasn't hour,that wasn't Tower,that wasn't sour,that wasn't tower,sour
sour,2000,what was 2000,that was 2000,what was 27,727,that was 27
carbonated,my last drink was in carbonated enough,my last drink with carbonated enough,my last drink was a carbonated enough,my last drink with a carbonated enough,my last drink was in carbonite enough,my last drink was in carbonated enuff
carbonated,my last drink should have had less carbs,my last drink should have had less carpet,my last drink should have a scar,my last drink should have had less carbon,my last drink should have had a scarf,my last drink should have had a scar
creamy,my left ring finger,my left ring,my last drink,my left ring finger mean,my left ring mean,
creamy,my last drink should have been less creamy,my last drink should have been a screaming,my last drink should have been a screening,my last drink should have been us creamy,my last drink should have been the screen,my last drink should have been nice creamy
sweet,my last drink with me tonight,my last drink with dinner,my last drink with sweetener,my last drink with sweet enough,my last drink was sweetener,my last drink with an A
sweet,set wrinkles way too sweet,set wrinkles Way too sweet,drinkers way too sweet,drinkers Way too sweet,set wrinkles way to sweet,set wrinkles way to sweeten
alcoholic,the drink with two week,the drink with 2 week,the drink with too weak,the drink with two weeks,the drink with 2 weeks,
alcoholic,my drinking too strong,my drink with too strong,my drink with two strong,my drink with two Strong,my drink with to Strong,my drink with 2 Strong
bitter,that wasn't better now,that wasn't better not,better in a,veterinary,that wasn't better in a,that wasn't veterinary
bitter,should have been less bitter,what should have been less bitter,should have been blessed better,what should have been blessed better,should have been less better,what should have been less better
sour,sudafed more sour,should have been more sour,the bed more sour,sudafed more Sauer,sudafed more Sour,should have been more Sauer
sour,what drink should have been us our,my drink should have been us our,what drink should have been left hour,my drink should have been left hour,what drink should have been less hours,what drink should have been left lower
carbonated,my drink need more carbonation,my drinking need more carbonation,my drink need more cover nation,my drinks need more carbonation,my drink need more carbon nation,my drink need more copper nation
carbonated,my drink carbonation,my drink combinations,my drink combination,carbonation,my drink combinations for,
creamy,my drink was way too crazy,my drink was way to creamy,my drink was way to cream,my drink was way to create,my drink was way to clean,what drink was way too crazy
bad,drink with fat,drink with bat,drink with bad,drink with that,drink with phat,the drink with fat
bad,my last drink was bad,my last drink with bad,my last drink with Bad,my last drink with pad,my last drink was Bad,my last drink Wiz Bad
good,that drink was good,that drink is good,that drink with good,that drink is good for,that drink was Good,that drink with Good
good,my last drink was good,my last drink with good,my last drink was Good,my last drink with Good,my last drink with Goode,my last drink with good for
bad,bad,Bad,last drink with bad,last drink with dad,last drink with that,address bad
bad,drink sake,drink suck,drink sucked,drinks up,drink sucks,drinks suck
bad,my drink sake,my drink,my drink suck,my drink soda,my drink soft,my drinking suck
good,is great,great,Great,drink with great,is Great,is greater
bad,set wrinkles awful,set wrinkles offal,set wrinkles on full,set wrinkels awful,set rinkles awful,set wrinkle awful
bad,what was awful,what was offal,what was of offal,what was all offal,what was off offal,what was the offal
good,that was great,what was great,I was great,what was Great,that was Great,great
good,my last drink was great,my last drink with great,my last drink is great,my last drink with grey,my last drink with gray,
bad,I hated that,I hate that,I hate it that,I hate it back,I hated,
bad,I hated my last drink,I hate my last drink,I hated my last rank,I hated my last rink,I hate my last rank,I hate it my last drink
good,I love my last drink,I love my last rank,I love my last rink,I love my last train,I love my left rink,I love my last drink it
good,I love my drink,I love my last drink,I love my drank,I love my strength,I love my ring,
bad,didn't like that,didn't like fat,,,,
bad,I didn't like that drink,I didn't like that drank,I didn't like that drinking,I didn't like that rink,I didn't like that drunk,I didn't like that- rink
good,I love that,I love bad,I love fat,I love back,I love dad,
good,I like that drink,I like that drank,I like to drink,I like that rink,I like that drinks,I like that- rink
bad,that wasn't very good,drink wasn't very good,drinking wasn't very good,wasn't very good,Patrick wasn't very good,drinks wasn't very good
bad,my last drink wasn't very good,my last drink was a very good,my last drink was a very good year,my last drink wasn't very gud,my last drink wasn't very good year,my last drink wasn't very good for
good,my last drink with good,my last drink with God,my last drink with Good,my last drink with a good,my last drink with Goode,my last drink a good
